date,username,to,replies,retweets,favorites,text,geo,mentions,hashtags,id,permalink
2017-10-09 08:26:46,tim_cook,,100,735,5241,"At Normandy, honoring those who made the ultimate sacrifice. “Think not only upon their passing. Remember the glory of their spirit.”pic.twitter.com/Unq6NXoe5y",,,,917305325115633664,https://twitter.com/tim_cook/status/917305325115633664
2017-10-09 08:00:12,tim_cook,,98,772,3729,"Thanks to my friends at Eldim, a team of talented engineers and craftspeople helping make iPhone possible. Bravo pour votre travail! pic.twitter.com/hEpxD3iBGf",,,,917298636173783040,https://twitter.com/tim_cook/status/917298636173783040
2017-10-06 21:50:21,tim_cook,,116,659,4051,"Saluting the many #womenintech representing Apple at #GHC17 and helping build the future of our industry.pic.twitter.com/NIC18EL8Oo",,,#womenintech #GHC17,916420386966855680,https://twitter.com/tim_cook/status/916420386966855680
2017-10-05 12:47:18,tim_cook,,1022,15586,44065,"Remembering Steve today. Still with us, still inspiring us. “Make something wonderful, and put it out there.”pic.twitter.com/7aOCPkwU0U",,,,915921335993344001,https://twitter.com/tim_cook/status/915921335993344001
2017-10-03 18:48:10,tim_cook,,94,526,2727,"Our condolences to the Otellini family and everyone at Intel. Paul was a great friend of Apple.http://intel.ly/2fH5TAz",,,,915287376783589376,https://twitter.com/tim_cook/status/915287376783589376
2017-10-03 15:43:06,tim_cook,,56,1013,6347,"""You can stand me up at the gates of Hell / But I won't back down.” Rest in peace, #TomPetty. Thank you for your music and inspiration.",,,#TomPetty,915240804976779266,https://twitter.com/tim_cook/status/915240804976779266
2017-10-02 13:26:59,tim_cook,,179,2310,12909,"Our hearts are with the victims in Las Vegas, their families and loved ones who are grieving this morning.",,,,914844159483113472,https://twitter.com/tim_cook/status/914844159483113472
2017-09-30 22:43:31,tim_cook,usairforce,321,5433,19897,"This is what leadership looks like.https://twitter.com/usairforce/status/913541082637578240 …",,,,914259440290848769,https://twitter.com/tim_cook/status/914259440290848769
2017-09-29 19:52:58,tim_cook,,145,1329,5041,"Our hearts are with Puerto Rico. La Isla del Encanto will rise again. Please join us in supporting relief efforts: http://apple.co/2xmVm50",,,,913854131386724352,https://twitter.com/tim_cook/status/913854131386724352
2017-09-28 23:20:48,tim_cook,,332,2129,7452,"At Apple, we believe privacy is a fundamental human right. Read the latest on our efforts to protect your data:http://apple.co/1uJqaWk",,,,913544049088282624,https://twitter.com/tim_cook/status/913544049088282624
2017-09-23 01:25:11,tim_cook,oyuelaphoto,355,799,4628,"Portrait Lighting on the new iPhone 8 Plus by @oyuelaphoto is amazing. Can’t wait to see what our customers do with the new #iPhone!https://twitter.com/oyuelaphoto/status/911207097722966016 …",,@oyuelaphoto,#iPhone,911401021347217408,https://twitter.com/tim_cook/status/911401021347217408
2017-09-22 21:47:36,tim_cook,,206,708,4676,"The first thing you do with your new #AppleWatchSeries3: Call Mom http://apple.co/2xkZ9CG pic.twitter.com/qcll0YbZye",,,#AppleWatchSeries3,911346264939175936,https://twitter.com/tim_cook/status/911346264939175936
2017-09-21 20:50:04,tim_cook,,1172,23269,56828,"Mientras hay vida, hay esperanza. Mexico’s resilience is its strength. Apple is contributing $1M to recovery efforts. #FuerzaMexico",,,#FuerzaMexico,910969400160788480,https://twitter.com/tim_cook/status/910969400160788480
2017-09-20 18:47:51,tim_cook,TheEllenShow,138,1097,6552,"It was great to meet you, Alex! Looking forward to seeing you at WWDC 2018! @TheAbilityApp @TheEllenShowhttps://twitter.com/theellenshow/status/910216154039250944 …",,@TheAbilityApp @TheEllenShowhttps,,910576253354291201,https://twitter.com/tim_cook/status/910576253354291201
2017-09-19 23:50:22,tim_cook,,399,10501,34451,"Nuestros pensamientos están con todos los afectados por el terremoto que sufrió México hoy. Rezando por nuestros amigos y colegas.",,,,910289999786123266,https://twitter.com/tim_cook/status/910289999786123266
2017-09-12 15:11:43,tim_cook,,1803,15097,51914,"It's a big day at Apple! We are honored and thrilled to host our first keynote at the Steve Jobs Theater this morning.pic.twitter.com/gyiqPJB46y",,,,907622761786253312,https://twitter.com/tim_cook/status/907622761786253312
2017-09-08 22:08:59,tim_cook,,245,779,3740,"Our thoughts and prayers are with those affected by #Irma. Please stay safe! Apple is proud to support #HandInHand.http://www.prnewswire.com/news-releases/hand-in-hand-a-benefit-for-hurricane-relief-announces-apple-donates-5-million-for-hurricane-relief-efforts-300516565.html …",,,#Irma #HandInHand,906278215282393088,https://twitter.com/tim_cook/status/906278215282393088
2017-09-07 22:46:56,tim_cook,,84,403,1766,"Powerful stories, striking portraits! Bravo @TIME and Luisa Dorr #ShotoniPhone #SheIsTheFirsthttp://apple.co/2eJLA4X",,@TIME,#ShotoniPhone #SheIsTheFirsthttp,905925379575078915,https://twitter.com/tim_cook/status/905925379575078915
2017-09-05 18:33:23,tim_cook,,1016,11829,36075,"#Dreamers contribute to our companies and our communities just as much as you and I. Apple will fight for them to be treated as equals.",,,#Dreamers,905136795645501440,https://twitter.com/tim_cook/status/905136795645501440
2017-09-03 12:38:13,tim_cook,,5608,50364,145172,"250 of my Apple coworkers are #Dreamers. I stand with them. They deserve our respect as equals and a solution rooted in American values.",,,#Dreamers,904322640654897152,https://twitter.com/tim_cook/status/904322640654897152
2017-08-27 13:01:47,tim_cook,,450,1318,4883,"Prayers for Texas and all those affected by #HurricaneHarvey. Join us in the relief effort by donating: http://apple.co/2xmVm50",,,#HurricaneHarvey,901791855108530176,https://twitter.com/tim_cook/status/901791855108530176
2017-08-26 20:06:21,tim_cook,,220,2021,9460,"Saluting the incredible women at Apple, and around the world, who are leading the way to a better future. #WomensEqualityDay",,,#WomensEqualityDay,901536314729701376,https://twitter.com/tim_cook/status/901536314729701376
2017-08-25 21:04:30,tim_cook,,158,445,3809,"Thanks to all my friends in Texas, new and old, for another amazing visit! Please stay safe as the storm comes ashore.",,,,901188560774213633,https://twitter.com/tim_cook/status/901188560774213633
2017-08-25 20:38:45,tim_cook,,130,437,3681,"Visiting our great customers and employees today at Apple The Domain was a treat. Apple Austin! Thanks for 25 fantastic years.pic.twitter.com/dg0LWivmlF",,,,901182077625880576,https://twitter.com/tim_cook/status/901182077625880576
2017-08-25 20:07:00,tim_cook,,315,765,5515,"Apple has the best customer service because we have the best people. Thrilled to see #AppleCare advisors in action today in Austin!pic.twitter.com/OHzQEmgG4C",,,#AppleCare,901174088558944257,https://twitter.com/tim_cook/status/901174088558944257
2017-08-25 19:42:57,tim_cook,,97,397,2196,"Everyone deserves equal access to a great education. Proud to stand w/ @accdistrict to launch our App Development with Swift curriculum.pic.twitter.com/BnQKofpumb",,@accdistrict,,901168036216025091,https://twitter.com/tim_cook/status/901168036216025091
2017-08-25 19:34:15,tim_cook,,66,329,1928,"Thx @JoshuaBaer for a fantastic morning @CapitalFactory. Developer creativity is off the charts. We’re as excited about iOS 11 as you are!pic.twitter.com/lCe0mI2mtr",,@JoshuaBaer @CapitalFactory,,901165846395056129,https://twitter.com/tim_cook/status/901165846395056129
2017-08-24 21:03:01,tim_cook,,121,359,3028,"Great day in the Hawkeye State! A shout out to the dedicated team at Apple Jordan Creek.pic.twitter.com/94b1nHztCA",,,,900825796952158208,https://twitter.com/tim_cook/status/900825796952158208
2017-08-24 21:00:55,tim_cook,,36,248,1700,". @WaukeeAPEX thanks for showing me around! Loved seeing the collaboration among students and depth of learning at your school.pic.twitter.com/5tXirdzEaO",,@WaukeeAPEX,,900825268759261186,https://twitter.com/tim_cook/status/900825268759261186
2017-08-24 20:45:52,tim_cook,,0,21,100,"@WaukeeAPEX thanks for showing me around! Loved seeing the collaboration among students and depth of learning at your school.pic.twitter.com/Vjy8J3c2Id",,@WaukeeAPEX,,900821484201025536,https://twitter.com/tim_cook/status/900821484201025536
2017-08-24 19:46:43,tim_cook,,58,340,1984,"Looking forward to working with @KimReynoldsIA & @CityofWaukee for Apple's newest data center to serve N American customers.pic.twitter.com/anKRn8VGOE",,@KimReynoldsIA @CityofWaukee,,900806597395578880,https://twitter.com/tim_cook/status/900806597395578880
2017-08-24 14:42:38,tim_cook,,189,623,3690,"Thanks to the team at CTS in Cincinnati, manufacturers of best-in-class testing equipment for Apple. Enjoyed my visit this morning!pic.twitter.com/lFLW5caYxw",,,,900730071178248192,https://twitter.com/tim_cook/status/900730071178248192
2017-08-22 13:39:15,tim_cook,,101,518,3439,"Our hearts are with the families and loved ones of those lost aboard the #USSJohnSMcCain, and all the brave men and women who serve.",,,#USSJohnSMcCain,899989346459070465,https://twitter.com/tim_cook/status/899989346459070465
2017-08-17 18:03:02,tim_cook,,497,6872,20454,"Ataques trágicos y sin sentido en Barcelona. Nuestros pensamientos están hoy con todos nuestros amigos y compañeros en esa gran ciudad.",,,,898243787016650752,https://twitter.com/tim_cook/status/898243787016650752
2017-08-14 16:11:13,tim_cook,,881,5921,22476,"We’ve seen the terror of white supremacy & racist violence before. It's a moral issue - an affront to America. We must all stand against it",,,,897128485843382277,https://twitter.com/tim_cook/status/897128485843382277
2017-08-12 22:59:12,tim_cook,,408,3592,14278,"Heartbreaking scenes in #Charlottesville. Violence and racism have no place in America.",,,#Charlottesville,896506383968870400,https://twitter.com/tim_cook/status/896506383968870400
2017-08-05 01:29:01,tim_cook,,336,4181,20650,"Thanks @ddlovato for helping us celebrate diversity and showing the world what it means to have courage and heart!pic.twitter.com/UXUoUsm5TA",,@ddlovato,,893644983017676801,https://twitter.com/tim_cook/status/893644983017676801
2017-08-03 02:29:47,tim_cook,,131,952,2918,"An #accessibility breakthrough for people with hearing loss. Proud of our team's work with @CochlearUS http://apple.co/2uW72wD @WIRED",,@CochlearUS @WIRED,#accessibility,892935498129301504,https://twitter.com/tim_cook/status/892935498129301504
2017-07-26 19:00:36,tim_cook,,890,6791,22817,"We are indebted to all who serve. Discrimination against anyone holds everyone back. #LetThemServe",,,#LetThemServe,890285745092444160,https://twitter.com/tim_cook/status/890285745092444160
2017-07-22 01:13:37,tim_cook,,151,429,3572,"A salute to the bright minds of our 2017 interns. Thank you for your contributions and enjoy the rest of the summer!pic.twitter.com/vqRLDaBvgv",,,,888567676502659072,https://twitter.com/tim_cook/status/888567676502659072
2017-07-17 15:09:32,tim_cook,,1040,11570,24348,"Happy #WorldEmojiDay! We’ve got some new ones to show you, coming later this year! https://nr.apple.com/dE0W5C8v9b pic.twitter.com/fhDrr4J5KG",,,#WorldEmojiDay,886966103531900928,https://twitter.com/tim_cook/status/886966103531900928
2017-07-15 21:12:36,tim_cook,,250,694,4960,"Join me in celebrating National Parks today! Complete a 3.5 mile walk/run/roll workout with your Apple Watch and earn a new achievement.pic.twitter.com/ub4LNpvz4E",,,,886332695227228160,https://twitter.com/tim_cook/status/886332695227228160
2017-07-11 04:17:22,tim_cook,,189,907,5388,"Saddened by the tragic loss of life in Mississippi. Our prayers are with the families and all those who serve.",,,,884627650181906432,https://twitter.com/tim_cook/status/884627650181906432
2017-07-04 12:48:46,tim_cook,,651,6426,20208,"Wishing everyone a happy #Independence Day! “Remember always that all of us ... are descended from immigrants and revolutionists.” -FDR",,,#Independence,882219636816609280,https://twitter.com/tim_cook/status/882219636816609280
2017-07-01 17:56:38,tim_cook,,124,646,4023,"Happy #CanadaDay to everyone celebrating! / Bonne #FêteDuCanada à tous ceux qui célèbrent!",,,#CanadaDay #FêteDuCanada,881209949543641091,https://twitter.com/tim_cook/status/881209949543641091
2017-07-01 14:26:13,tim_cook,tim_cook,23,195,801,"Here's Détour, #shotoniphone by @MichelGondry, with English subtitles. http://apple.com/uk/detour/",,@MichelGondry,#shotoniphone,881156995071586306,https://twitter.com/tim_cook/status/881156995071586306
2017-07-01 14:18:46,tim_cook,,45,575,1939,"Love this new short film by @MichelGondry #shotoniphone. Vive le cinéma français. http://apple.com/fr/detour",,@MichelGondry,#shotoniphone,881155119634665476,https://twitter.com/tim_cook/status/881155119634665476
2017-06-30 14:33:10,tim_cook,,90,800,3984,"National Parks are some of my favorite places on earth. Proud to work with @GoParks on preserving these treasures! https://nr.apple.com/dE0q3r3g7T",,@GoParks,,880796356457136129,https://twitter.com/tim_cook/status/880796356457136129
2017-06-29 16:41:04,tim_cook,,829,15157,36862,"Here's to the #iPhone that changed the world, to the man who dreamed it & the people at Apple who have never stopped looking to its future.pic.twitter.com/kw3Ifx0qmi",,,#iPhone,880466154019356672,https://twitter.com/tim_cook/status/880466154019356672
2017-06-28 21:00:12,tim_cook,,54,687,2532,"Celebrating Canadian optimism & diversity / Célébrons l’optimisme et la diversité du Canada #shotoniphonehttps://www.apple.com/ca/newsroom/2017/06/apple-celebrates-optimism-with-a-portrait-of-canada …",,,#shotoniphonehttps,880168981486632960,https://twitter.com/tim_cook/status/880168981486632960
2017-06-26 21:21:53,tim_cook,,100,444,2415,"Thanks @ChuckRobbins for hosting me today. Key features and security advancements for business in iOS 11 and through our partnership.pic.twitter.com/BcUmrdv87E",,@ChuckRobbins,,879449662696050688,https://twitter.com/tim_cook/status/879449662696050688
2017-06-26 16:41:53,tim_cook,,481,6614,20430,"Great to see you again @narendramodi. We’re inspired by your vision for India and excited about what we can achieve together.pic.twitter.com/oSR5Lat6v8",,@narendramodi,,879379198913069056,https://twitter.com/tim_cook/status/879379198913069056
2017-06-25 22:19:28,tim_cook,,162,2087,9591,"Happy #Pride2017 to all our employees, their families and customers around the world! Today we're showing #applepride in SF, NYC and Torontopic.twitter.com/ngM48Fy0Ws",,,#Pride2017 #applepride,879101766729650176,https://twitter.com/tim_cook/status/879101766729650176
2017-06-24 01:16:11,tim_cook,,889,8890,19150,"Eid Mubarak to everyone celebrating around the world! Wishing you and your loved ones peace, joy and prosperity.",,,,878421460217249793,https://twitter.com/tim_cook/status/878421460217249793
2017-06-21 02:04:48,tim_cook,,119,374,2730,"Moving visit to the American Veterans Disabled for Life Monument. “In war, there are no unwounded soldiers.” Thank you for your sacrifice.pic.twitter.com/sCyqcqiPXk",,,,877346532017811456,https://twitter.com/tim_cook/status/877346532017811456
2017-06-19 17:02:28,tim_cook,,143,1595,6871,"Our hearts are with you, London. “Hate, it has caused a lot of problems in the world, but has not solved one yet.” -M. Angelou",,,,876847663886594048,https://twitter.com/tim_cook/status/876847663886594048
2017-06-18 15:17:30,tim_cook,,124,918,6656,"To all the fathers I'm privileged to know and work with, and to dads everywhere, Happy #FathersDay!",,,#FathersDay,876458858683576320,https://twitter.com/tim_cook/status/876458858683576320
2017-06-14 22:29:51,tim_cook,austinmann,179,350,2853,"Enjoy your new iPad Pro @austinmann! We're thrilled with the feedback we're getting from creative pros and customers everywhere!https://twitter.com/austinmann/status/875084857864572928 …",,@austinmann,,875118111925559296,https://twitter.com/tim_cook/status/875118111925559296
2017-06-14 14:05:47,tim_cook,,115,876,4484,"Saddened by the terrifying events in Virginia. Our prayers are with all those affected. Such violence has no place in America - or anywhere.",,,,874991261026967554,https://twitter.com/tim_cook/status/874991261026967554
2017-06-11 20:54:44,tim_cook,,751,2484,9180,"Here comes Apple Taipei 101, our first store in Taiwan! 有閒來坐!pic.twitter.com/hniIt9K3Xa",,,,874007011087732737,https://twitter.com/tim_cook/status/874007011087732737
2017-06-10 03:16:02,tim_cook,,82,371,2463,"Thanks @RedSox & #redsoxnation for capping a fun day in Boston! #WinDanceRepeatpic.twitter.com/DvhPV2tVrK",,@RedSox,#redsoxnation #WinDanceRepeatpic,873378191217504257,https://twitter.com/tim_cook/status/873378191217504257
2017-06-09 22:46:00,tim_cook,,85,360,3052,"Great to be back at Apple Boylston Street visiting our incredible team and customers today!pic.twitter.com/XeeWtG2Bc5",,,,873310238383931393,https://twitter.com/tim_cook/status/873310238383931393
2017-06-09 19:19:04,tim_cook,,85,869,5381,"Congratulations, @MIT class of 2017! Today, all of humanity has good cause for hope.pic.twitter.com/10g3f7ZbDd",,@MIT,,873258159657365505,https://twitter.com/tim_cook/status/873258159657365505
2017-06-09 13:50:32,tim_cook,,114,790,4348,"Hope everyone had a great week at WWDC! Developers, we can't wait to see what you create next. Already looking forward to next year!pic.twitter.com/EqxvozFRrU",,,,873175482220544000,https://twitter.com/tim_cook/status/873175482220544000
2017-06-08 23:31:43,tim_cook,,106,678,4075,"So impressed by @MIT students & faculty who are finding new ways to tackle the world’s biggest challenges. Thanks for sharing your work!pic.twitter.com/6Fx5t7ePr4",,@MIT,,872959355301355520,https://twitter.com/tim_cook/status/872959355301355520
2017-06-06 21:51:24,tim_cook,,217,2580,11811,"Thank you @MichelleObama for sharing your views on diversity & innovation, and for encouraging developers to make the world a better place.pic.twitter.com/IlJRBcb5Di",,@MichelleObama,,872209331810295809,https://twitter.com/tim_cook/status/872209331810295809
2017-06-06 15:02:04,tim_cook,,92,715,4711,"A huge day of exciting announcements at WWDC yesterday! We’re back for Day 2 - have a great week, developers!pic.twitter.com/CyQLWoVfNl",,,,872106320400338945,https://twitter.com/tim_cook/status/872106320400338945
2017-06-05 13:46:03,tim_cook,,310,3527,10750,"Just a few more hours to go, developers! We've got a big week ahead. See you at the keynote! #WWDC17pic.twitter.com/ewnOg3dXQ5",,,#WWDC17pic,871724803920625664,https://twitter.com/tim_cook/status/871724803920625664
2017-06-04 23:44:41,tim_cook,,141,1002,5436,"Kicking off #WWDC17 with this year's talented scholarship recipients. See you all tomorrow morning!pic.twitter.com/4kovS1cAzX",,,#WWDC17,871513064088064000,https://twitter.com/tim_cook/status/871513064088064000
2017-06-04 00:41:45,tim_cook,,241,2390,11692,"Shocked by more senseless attacks in London. Our hearts go out to our friends, coworkers, neighbors and everyone in that great city.",,,,871165041289998336,https://twitter.com/tim_cook/status/871165041289998336
2017-06-02 00:36:46,tim_cook,,1585,13949,38970,"Decision to withdraw from the #ParisAgreeement was wrong for our planet. Apple is committed to fight climate change and we will never waver.",,,#ParisAgreeement,870439008316276736,https://twitter.com/tim_cook/status/870439008316276736
2017-06-01 14:35:31,tim_cook,,215,668,2609,"A tremendous milestone for our developers who create the very best apps & games for our customers around the worldhttps://www.apple.com/newsroom/2017/06/developer-earnings-from-the-app-store-top-70-billion/ …",,,,870287701043433472,https://twitter.com/tim_cook/status/870287701043433472
2017-05-29 16:42:37,tim_cook,,137,571,2046,"“The human mind is our fundamental resource.” On #JFK's 100th birthday, we celebrate his legacy by learning.https://www.apple.com/education/jfk100/ …",,,#JFK,869232521266946048,https://twitter.com/tim_cook/status/869232521266946048
2017-05-29 14:15:35,tim_cook,,57,851,4071,"We honor the heroes who gave their lives for our freedom. They and their families have our eternal gratitude #MemorialDay",,,#MemorialDay,869195521457479682,https://twitter.com/tim_cook/status/869195521457479682
2017-05-27 22:31:35,tim_cook,,110,478,2807,"Heartbroken at the passing of @GreggAllman I grew up listening to your soulful voice & will never forget you. RIP midnight rider.",,@GreggAllman,,868595567072387072,https://twitter.com/tim_cook/status/868595567072387072
2017-05-27 14:46:41,tim_cook,,127,809,3387,"Congratulations team, and thanks to the thousands of customers who joined us at the new #AppleOrchardRoad in Singapore. Huat ah! pic.twitter.com/rXUrq3dBhE",,,#AppleOrchardRoad,868478569210462208,https://twitter.com/tim_cook/status/868478569210462208
2017-05-26 13:31:51,tim_cook,,68,291,1206,"""This was a risky drawing to make ... I kept worrying that the ball would hit me or the iPad."" @thejorgecolombo http://www.newyorker.com/culture-desk/cover-story/cover-story-2017-05-29 …",,@thejorgecolombo,,868097350765469697,https://twitter.com/tim_cook/status/868097350765469697
2017-05-25 00:36:16,tim_cook,SylvesterTurner,87,303,1183,"Thrilled to be working with @HCCDistrict and other leading community colleges on new ways to teach app development! https://www.apple.com/newsroom/2017/05/apple-launches-app-development-curriculum-for-high-school-community-college-students/ …https://twitter.com/sylvesterturner/status/867470624008044544 …",,@HCCDistrict,,867539778727591936,https://twitter.com/tim_cook/status/867539778727591936
2017-05-23 00:31:11,tim_cook,,164,2445,9142,"Deeply saddened by the tragic events in Manchester. Our thoughts are with everyone affected.",,,,866813724601876481,https://twitter.com/tim_cook/status/866813724601876481
2017-05-21 13:31:20,tim_cook,AngelaAhrendts,231,598,2433,"Our stores are dedicated to educating, inspiring and enriching lives. http://apple.com/today https://twitter.com/angelaahrendts/status/866114307494338562 …",,,,866285280675774465,https://twitter.com/tim_cook/status/866285280675774465
2017-05-20 13:06:20,tim_cook,,107,668,3190,"We are indebted to all the courageous women & men who serve our country, and the families who support them. Thank you! #ArmedForcesDay",,,#ArmedForcesDay,865916603757608961,https://twitter.com/tim_cook/status/865916603757608961
2017-05-19 13:43:03,tim_cook,,71,770,4402,"Thank you to the incomparable Stevie Wonder for lifting hearts and celebrating accessibility with us! #GAADpic.twitter.com/WvePkgte5R",,,#GAADpic,865563452542074882,https://twitter.com/tim_cook/status/865563452542074882
2017-05-18 02:13:08,tim_cook,,136,379,1707,"Thanks @JamesRath @PintSzDiva @RikkiPoynter for visiting Apple for #GAAD! Great conversations about the importance of accessibility.pic.twitter.com/APg8J3LRvY",,@JamesRath @PintSzDiva @RikkiPoynter,#GAAD,865027444041932801,https://twitter.com/tim_cook/status/865027444041932801
2017-05-14 16:32:36,tim_cook,,196,1267,5323,"Happy #MothersDay to moms everywhere! ""Behind all your stories is always your mother's story, because hers is where yours begins."" -M. Albom",,,#MothersDay,863794182950756352,https://twitter.com/tim_cook/status/863794182950756352
2017-04-28 01:30:43,tim_cook,,981,652,2778,"Gorgeous store, phenomenal team! Thanks to everyone who came out to see the new Apple Dubai Mall. https://nr.apple.com/dE3a8d0d5u",,,,857769010028359680,https://twitter.com/tim_cook/status/857769010028359680
2017-04-22 14:21:03,tim_cook,,602,1655,6728,"Happy #EarthDay! Get outside, enjoy our planet and complete a 30-minute workout today to earn a special badge on Apple Watch.pic.twitter.com/hehDRXxXj5",,,#EarthDay,855788546413576192,https://twitter.com/tim_cook/status/855788546413576192
2017-04-21 14:56:50,tim_cook,,209,2243,6514,"We’re making progress toward a greener future. Our next goal: making products without mining new materials #EarthDay http://apple.com/environment pic.twitter.com/MuMYIlcUiU",,,#EarthDay,855435161302781952,https://twitter.com/tim_cook/status/855435161302781952
2017-04-21 11:33:38,tim_cook,,327,7137,17534,"Türkiye'de Ulusal Egemenlik ve Çocuk Bayramı’nı genç yeteneklerin çektiği müthiş fotoğraflarla kutluyoruz. #23Nisan #iPhoneileçekildi pic.twitter.com/VUqrUjH92G",,,#23Nisan #iPhoneileçekildi,855384024985985025,https://twitter.com/tim_cook/status/855384024985985025
2017-04-16 12:35:30,tim_cook,,307,1298,6723,"In this season of renewal and hope, Happy Easter and wishes of peace for people everywhere.",,,,853587655161896961,https://twitter.com/tim_cook/status/853587655161896961
2017-04-15 20:20:18,tim_cook,,61,925,2961,"Timeless words from #42, ""The right of every American to first-class citizenship is the most important issue of our time"" #JackieRobinsonDaypic.twitter.com/7Dr6no5cr6",,,#42 #JackieRobinsonDaypic,853342236624302080,https://twitter.com/tim_cook/status/853342236624302080
2017-04-09 20:37:19,tim_cook,,523,2615,4388,"نعبِّر عن بالغ حزننا وأسفنا حول التفجيرات المروعة في مصر ونعزي جميع أهلها",,,,851172191215288321,https://twitter.com/tim_cook/status/851172191215288321
2017-04-09 16:35:19,tim_cook,,134,526,2609,"Congrats @waltmossberg on a remarkable career & thanks for everything you've done for consumers! Enjoy next chapter. https://www.google.com/amp/www.recode.net/platform/amp/2017/4/7/15211374/walt-mossberg-the-only-kingmaker-is-retiring …",,@waltmossberg,,851111291229847552,https://twitter.com/tim_cook/status/851111291229847552
2017-04-07 16:40:59,tim_cook,,145,1176,3885,"Våra tankar går till våra vänner i Stockholm efter dagens fruktansvärda händelser.",,,,850387942811901952,https://twitter.com/tim_cook/status/850387942811901952
