date,username,to,replies,retweets,favorites,text,geo,mentions,hashtags,id,permalink
2017-04-07 12:58:36,tim_cook,,46,502,2123,"This Auburn team is fired up for A-Day & the 2017 season! This is our time. Thanks @CoachGusMalzahn & @AuburnFootball for an awesome visit!pic.twitter.com/TXcltntTna",,@CoachGusMalzahn @AuburnFootball,,850331979174207489,https://twitter.com/tim_cook/status/850331979174207489
2017-04-06 23:45:02,tim_cook,,72,217,1422,"Catching up with @finebaum at Jordan-Hare. Have fun on A-Day @AuburnU! #WarEagle @SECNetworkpic.twitter.com/bpQUXlwU9c",,@finebaum @AuburnU @SECNetworkpic,#WarEagle,850132270308618240,https://twitter.com/tim_cook/status/850132270308618240
2017-04-06 20:26:26,tim_cook,,89,924,4158,"Thanks @AuburnU for the warm welcome home! Great conversation with students today. #WarEaglepic.twitter.com/Bzd4WIN0O6",,@AuburnU,#WarEaglepic,850082289178595328,https://twitter.com/tim_cook/status/850082289178595328
2017-04-03 16:22:37,tim_cook,,731,12963,40367,"Искренние соболезнования всем, кого коснулась трагедия в Санкт-Петербурге",,,,848933768974942210,https://twitter.com/tim_cook/status/848933768974942210
2017-03-24 23:47:54,tim_cook,,449,1300,5812,"Thanks to our customers supporting (RED) through the new, special edition iPhone 7! Together, we’re moving toward an AIDS-free generation.pic.twitter.com/tpA7VZgB2z",,,,845421951040442368,https://twitter.com/tim_cook/status/845421951040442368
2017-03-24 15:48:02,tim_cook,,70,797,2503,"Incredible story, courageous boy. Well done, Roman! We pray for your mom's speedy recovery.http://www.standard.co.uk/news/london/fouryearold-boy-saves-mothers-life-by-dialling-999-using-siri-a3496601.html …",,,,845301184843821056,https://twitter.com/tim_cook/status/845301184843821056
2017-03-22 22:11:25,tim_cook,,145,1521,7207,"Standing with our friends in London in the face of today's senseless attack.",,,,844672891811610624,https://twitter.com/tim_cook/status/844672891811610624
2017-03-19 00:13:20,tim_cook,,146,1153,4687,"""He could play the guitar just like ringing a bell."" We will miss you, Chuck Berry.",,,,843254020613509121,https://twitter.com/tim_cook/status/843254020613509121
2017-03-17 22:23:30,tim_cook,,63,406,2486,"Wishing a #HappyStPatricksDay to friends everywhere, and remembering a great visit to Ireland just over a year ago!pic.twitter.com/o7fApJnbYV",,,#HappyStPatricksDay,842863993505177602,https://twitter.com/tim_cook/status/842863993505177602
2017-03-08 21:54:04,tim_cook,,249,1259,4809,"Women’s rights are human rights. Today we celebrate, we speak up and we listen. #InternationalWomensDaypic.twitter.com/YqQlRoAkyO",,,#InternationalWomensDaypic,839595094990692352,https://twitter.com/tim_cook/status/839595094990692352
2017-03-05 20:01:12,tim_cook,,85,584,1954,"#BloodySunday @repjohnlewis Eternal symbols of courage in the face of adversity. In our hearts, minds & actions, the work continues #Selma52pic.twitter.com/rWLAXc8tdK",,@repjohnlewis,#BloodySunday #Selma52pic,838479528024403968,https://twitter.com/tim_cook/status/838479528024403968
2017-02-24 14:31:53,tim_cook,,523,9382,19650,"Remembering Steve, whose words and ideals will always inspire us. “There is no reason not to follow your heart.”pic.twitter.com/MihKSnbYiQ",,,,835135164573343744,https://twitter.com/tim_cook/status/835135164573343744
2017-02-24 02:21:20,tim_cook,,120,743,3342,"Um ótimo Carnaval, Brasil! Estamos muito felizes por fazer parte desta festa #modoretrato #portraitmodepic.twitter.com/Dc8A6o1SYk",,,#modoretrato #portraitmodepic,834951314119393280,https://twitter.com/tim_cook/status/834951314119393280
2017-02-22 14:34:12,tim_cook,,291,4639,10609,"The campus Steve envisioned will be known as Apple Park, and its theater will bear his name. http://nr.apple.com/dE0c5p1G9O",,,,834410968822091776,https://twitter.com/tim_cook/status/834410968822091776
2017-02-21 00:14:58,tim_cook,_jmerrigan,94,347,2184,"Stunning #portraitmode photography by @_jmerrigan!https://twitter.com/_jmerrigan/status/833147890629484544 …",,@_jmerrigan,#portraitmode,833832347753607168,https://twitter.com/tim_cook/status/833832347753607168
2017-02-10 17:45:43,tim_cook,,59,401,2115,"Inspired by the phenomenally talented students @TheBRITSchool. A special & truly unique place.pic.twitter.com/oT8EFatMKl",,@TheBRITSchool,,830110512222441472,https://twitter.com/tim_cook/status/830110512222441472
2017-02-10 10:13:24,tim_cook,Tate,29,225,1262,"Congratulations @Tate for a spectacular exhibit!https://twitter.com/tate/status/829813769643646977 …",,@Tate,,829996681550667776,https://twitter.com/tim_cook/status/829996681550667776
2017-02-09 17:47:23,tim_cook,,69,393,1772,". @woodberrydownN4 is doing inspiring work teaching coding with Swift Playgrounds! Looking forward to the future these students will create.pic.twitter.com/7lIm9yDgqe",,@woodberrydownN4,,829748543103627264,https://twitter.com/tim_cook/status/829748543103627264
2017-02-09 17:44:48,tim_cook,,57,536,2697,"Met the incredibly creative team behind #MonumentValleyGame @ustwogames in London & got a sneak peek at their latest project, coming soon!pic.twitter.com/oqIksKpd2w",,@ustwogames,#MonumentValleyGame,829747892982263810,https://twitter.com/tim_cook/status/829747892982263810
2017-02-09 15:42:30,tim_cook,MayorofLondon,71,531,2510,"Great to meet @MayorofLondon today. We are incredibly excited about Apple's future in London and the !https://twitter.com/mayoroflondon/status/829704480853737474 …",,@MayorofLondon,,829717113908633603,https://twitter.com/tim_cook/status/829717113908633603
2017-02-08 21:06:39,tim_cook,,72,686,2833,"Humbled & honored to become part of the @UofGlasgow community tonight. Thank you to the faculty & students of this great university!pic.twitter.com/YpwArFUgGr",,@UofGlasgow,,829436301661331458,https://twitter.com/tim_cook/status/829436301661331458
2017-02-08 20:34:35,tim_cook,,81,586,3839,"Thanks Apple Buchanan Street for a warm welcome on a cold day in Glasgow!pic.twitter.com/FJLeBNi29V",,,,829428235335299072,https://twitter.com/tim_cook/status/829428235335299072
2017-02-07 19:19:45,tim_cook,,82,496,3088,"Thanks for the cooking lesson @1KitchenStories! A cool app developer in Berlin reaching a global audience through the App Store.pic.twitter.com/jaqCeLGgye",,@1KitchenStories,,829047013350264834,https://twitter.com/tim_cook/status/829047013350264834
2017-02-07 14:12:32,tim_cook,,86,519,2430,"Bewundernswerte, außergewöhnliche Handwerkskunst bei unserem Zulieferer Dula heute Morgen in Vreden . Vielen Dank für die Tour!pic.twitter.com/va4n6oqtCn",,,,828969698788208641,https://twitter.com/tim_cook/status/828969698788208641
2017-02-06 21:43:37,tim_cook,,65,590,2624,"Yes, art can change the world. The amazing, incomparable @JRart.pic.twitter.com/fvIWr0VjL0",,@JRart,,828720832159608833,https://twitter.com/tim_cook/status/828720832159608833
2017-02-06 18:55:36,tim_cook,,40,476,2228,"Impressed by the creativity of young iOS developers @marbotic @PDolbeau @Logg_Apps today at Apple Marché Saint-Germain!pic.twitter.com/XPzbOPknXC",,@marbotic @PDolbeau @Logg_Apps,,828678546293940225,https://twitter.com/tim_cook/status/828678546293940225
2017-02-06 14:21:35,tim_cook,,39,209,1308,"Déjeuner with @VizEat co-founders Camilla & Jean-Michel. Thanks to our hosts - and new friends - Odile & Pierre for a wonderful meal!pic.twitter.com/WT6roAlY0S",,@VizEat,,828609588958081029,https://twitter.com/tim_cook/status/828609588958081029
2017-02-06 12:26:04,tim_cook,,47,323,1796,"Thrilled to spend some time with the incredibly talented @JulienFournie, whose exquisite new collection was created with iPad Pro.pic.twitter.com/CTSI3Q96CK",,@JulienFournie,,828580518908223489,https://twitter.com/tim_cook/status/828580518908223489
2017-02-05 19:03:36,tim_cook,fotomaniak_ig,40,381,1191,"Très impressionné par la créativité de @fotomaniak_ig, instagrameur marseillais de notre campagne Photographié avec l'iPhone.https://twitter.com/fotomaniak_ig/status/828299106812559365 …",,@fotomaniak_ig,,828318172377919491,https://twitter.com/tim_cook/status/828318172377919491
2017-02-05 18:11:59,tim_cook,,130,1383,3732,"Ravi d'être de nouveau en France et de rencontrer notre talentueuse équipe à Marseille. pic.twitter.com/ihJusWQP2o",,,,828305182668816384,https://twitter.com/tim_cook/status/828305182668816384
2017-01-28 17:36:23,tim_cook,,154,1364,3309,"Deeply moved today visiting @FordsTheatreNPS and Peterson House where Abraham Lincoln took his last breath. His words are timeless.pic.twitter.com/z6mMAvOdzK",,@FordsTheatreNPS,,825397122644267009,https://twitter.com/tim_cook/status/825397122644267009
2017-01-28 16:18:16,tim_cook,,60,407,1818,"Visit to @NMAAHC today was a moving, powerful reminder of human progress, and that the work toward equality is far from complete.",,@NMAAHC,,825377463945527296,https://twitter.com/tim_cook/status/825377463945527296
2017-01-27 23:47:10,tim_cook,,62,472,1763,"Thank you @ASBPhiladelphia for honoring Apple with the Louis Braille Award. Proud of our team's dedication to #accessibility.pic.twitter.com/mnAGD8EUH5",,@ASBPhiladelphia,#accessibility,825128043630956544,https://twitter.com/tim_cook/status/825128043630956544
2017-01-27 00:22:34,tim_cook,,364,960,3290,"祝大家鸡年大吉, 阖家平安! Wishing everyone peace, harmony and luck in the Year of the Rooster!",,,,824774566413266944,https://twitter.com/tim_cook/status/824774566413266944
2017-01-18 02:40:07,tim_cook,,120,381,1489,"Love watching the talented @LILBUCKDALEGEND in our new AirPods ad! https://www.youtube.com/watch?v=CvVvwh3BRq8 …",,@LILBUCKDALEGEND,,821547691305877504,https://twitter.com/tim_cook/status/821547691305877504
2017-01-16 21:15:15,tim_cook,,90,819,3920,"""Everybody can be great, because anybody can serve."" With Apple volunteers at Stege Elementary in Richmond, California this #MLKDaypic.twitter.com/Rwjhyjrc6F",,,#MLKDaypic,821103545067806720,https://twitter.com/tim_cook/status/821103545067806720
2017-01-16 02:17:02,tim_cook,,143,3204,7988,"We honor #MLK by working to help achieve justice and equality. ""We may have all come on different ships, but we're in the same boat now.”pic.twitter.com/dVQfg3CTSd",,,#MLK,820817104463134721,https://twitter.com/tim_cook/status/820817104463134721
2017-01-13 19:30:43,tim_cook,salim_merchant,221,509,2702,"Great to hear from so many people who love their #AirPods! Thanks @salim_merchant https://twitter.com/salim_merchant/status/819242024675246087 …",,@salim_merchant,#AirPods,819990077442928640,https://twitter.com/tim_cook/status/819990077442928640
2017-01-10 15:38:42,tim_cook,,156,1366,4248,"Proud to lead the @Greenpeace clean energy report for the third year in a row.http://www.cnbc.com/2017/01/10/apple-the-greenest-tech-company-in-the-world-greenpeace.html …",,@Greenpeace,,818844524264837120,https://twitter.com/tim_cook/status/818844524264837120
2017-01-01 17:42:55,tim_cook,,331,1933,7926,"May 2017 bring peace to the world and happiness and health to everyone. #HappyNewYearEveryone",,,#HappyNewYearEveryone,815614294855299072,https://twitter.com/tim_cook/status/815614294855299072
2017-01-01 01:49:47,tim_cook,,260,7754,25717,"Sevgili Türkiye, acınızı ve üzüntünüzü paylaşıyoruz. #Istanbul kalbimiz sizinle.",,,#Istanbul,815374429869907969,https://twitter.com/tim_cook/status/815374429869907969
2016-12-24 14:36:09,tim_cook,,312,2147,8288,"Wishing everyone peace and joy this holiday season. ""We must pursue peaceful ends through peaceful means."" -MLK 12/24/1967",,,,812668189763141633,https://twitter.com/tim_cook/status/812668189763141633
2016-12-10 13:24:23,tim_cook,,242,2800,5557,"""The destiny of human rights is in the hands of all our citizens in all our communities."" - Eleanor Roosevelt #HumanRightsDaypic.twitter.com/jTwpJ9ybzD",,,#HumanRightsDaypic,807576699789393920,https://twitter.com/tim_cook/status/807576699789393920
2016-12-09 00:38:34,tim_cook,,60,915,4013,"Godspeed, John Glenn. Thank you for inspiring my generation and many to come. Rest in peace.",,,,807021584925868032,https://twitter.com/tim_cook/status/807021584925868032
2016-12-03 17:38:22,tim_cook,,93,701,2258,"Merci à tous nos clients pour l'accueil chaleureux réservé à notre premier magasin à Saint-Germain. Et Vive Paris!pic.twitter.com/jpm89sZZyV",,,,805103901418536960,https://twitter.com/tim_cook/status/805103901418536960
2016-12-01 12:57:24,tim_cook,,135,1997,5361,"Apple is turning @RED for #WorldAIDSDay and marking 10 years of progress toward an AIDS-free generation. http://apple.com/red pic.twitter.com/ax4eIygwV1",,@RED,#WorldAIDSDay,804308417149956096,https://twitter.com/tim_cook/status/804308417149956096
2016-11-24 14:02:52,tim_cook,,219,1178,6143,"Giving thanks for family & friends, the incredible team at Apple and our customers around the world. Happy #Thanksgiving to all!",,,#Thanksgiving,801788175429472256,https://twitter.com/tim_cook/status/801788175429472256
2016-11-11 14:27:37,tim_cook,,225,1414,7010,"Proud to work alongside these & many more veterans at Apple. We honor all the brave men & women who sacrificed for our freedom. #VeteransDaypic.twitter.com/6muFEDAspH",,,#VeteransDaypic,797083363970400257,https://twitter.com/tim_cook/status/797083363970400257
2016-10-30 01:32:14,tim_cook,,201,1596,4947,"Wishing everyone peace and happiness this #Diwali! Stunning photos by @prashvish #shotoniphonepic.twitter.com/EfFaiJ1guy",,@prashvish,#Diwali #shotoniphonepic,792539575717539840,https://twitter.com/tim_cook/status/792539575717539840
2016-10-28 17:05:29,tim_cook,,221,686,3865,"to customers around the world who are picking up their new Apple Watch Nike+ today!pic.twitter.com/biwo5sOFog",,,,792049659879448576,https://twitter.com/tim_cook/status/792049659879448576
2016-10-27 23:35:03,tim_cook,,613,1630,6071,"Can't wait for our customers to try the all-new MacBook Pro and revolutionary Touch Bar!pic.twitter.com/xMEeIirwEp",,,,791785310682124288,https://twitter.com/tim_cook/status/791785310682124288
2016-10-27 22:07:05,tim_cook,sadyspaul,63,566,2385,"Thanks to the talented @sadyspaul for editing an amazing video and being a part of our event today.https://twitter.com/sadyspaul/status/791759188623921153 …",,@sadyspaul,,791763172411609088,https://twitter.com/tim_cook/status/791763172411609088
2016-10-27 16:03:25,tim_cook,,134,1232,4157,"Looking forward to an exciting day here on campus! #AppleEventpic.twitter.com/mi91C7XzVu",,,#AppleEventpic,791671652106973184,https://twitter.com/tim_cook/status/791671652106973184
2016-10-17 19:54:59,tim_cook,,112,662,1830,"""The American melting pot, with its new eyes and new imagi­nations, is an incubator for innovation."" @laurenepowellhttp://bit.ly/2e9iNbl",,@laurenepowellhttp,,788106049853136897,https://twitter.com/tim_cook/status/788106049853136897
2016-10-15 06:08:14,tim_cook,,133,2388,5283,"ありがとうpic.twitter.com/Xixe0SupG9",,,,787173214808080384,https://twitter.com/tim_cook/status/787173214808080384
2016-10-15 05:55:04,tim_cook,,54,623,2627,"Inspired by the Sendai spirit among our store team, as well as customers and local developers.pic.twitter.com/YKrgW6VzG4",,,,787169902687838208,https://twitter.com/tim_cook/status/787169902687838208
2016-10-15 03:31:43,tim_cook,,72,553,2756,"Celebrating a decade of partnership with the talented team at Cashew in Saitama, experts in plant-based coatings and resins.pic.twitter.com/3C1iPfvDSs",,,,787133827672055808,https://twitter.com/tim_cook/status/787133827672055808
2016-10-13 10:15:18,tim_cook,,203,2343,5461,"Just rode JRE's Yamanote line with Apple Pay. Can't wait for our customers in Japan to start using it later this month.pic.twitter.com/mMcK3iIaS4",,,,786510615321931776,https://twitter.com/tim_cook/status/786510615321931776
2016-10-13 01:34:39,tim_cook,,254,5662,13656,"Getting the hang of Super Mario Run, thanks to Miyamoto-san and his awesome team at Nintendo!pic.twitter.com/gSxU4iQbAv",,,,786379589832601600,https://twitter.com/tim_cook/status/786379589832601600
2016-10-10 17:07:44,tim_cook,,66,478,1733,"Our thoughts are with all those affected by #HurricaneMatthew. Support relief efforts by donating to @RedCross at http://apple.co/RedCross",,@RedCross,#HurricaneMatthew,785527246408646656,https://twitter.com/tim_cook/status/785527246408646656
2016-10-08 00:41:27,tim_cook,,272,1392,4992,"Shukriya India and everyone who turned out for Friday’s launch of iPhone 7 and Apple Watch Series 2! pic.twitter.com/EyxVKgRH0F",,,,784554265704534016,https://twitter.com/tim_cook/status/784554265704534016
2016-10-07 16:00:12,tim_cook,,60,479,1960,"I could swear this is heaven #OhMyMy @OneRepublic Amazing album! pic.twitter.com/ZjWa95O8GA",,@OneRepublic,#OhMyMy,784423087940866048,https://twitter.com/tim_cook/status/784423087940866048
2016-10-07 00:40:28,tim_cook,,108,1231,3822,"Prayers for all those affected by #HurricaneMatthew. To those in its path tonight, please stay safe.",,,#HurricaneMatthew,784191628240035841,https://twitter.com/tim_cook/status/784191628240035841
2016-10-05 13:39:11,tim_cook,,593,27324,30631,"""Most important, have the courage to follow your heart and intuition."" Remembering Steve and the many ways he changed our world.pic.twitter.com/ONAuEoq3uU",,,,783662822819401728,https://twitter.com/tim_cook/status/783662822819401728
2016-10-01 03:12:35,tim_cook,senorrinhatch,53,247,1116,"Thanks @SenOrrinHatch and everyone who attended tonight's event in Salt Lake City! #UtahTechTourhttps://twitter.com/senorrinhatch/status/782049970996203520 …",,@SenOrrinHatch,#UtahTechTourhttps,782055583889317892,https://twitter.com/tim_cook/status/782055583889317892
2016-09-28 23:01:35,tim_cook,,89,830,1961,"Excited to work with @PunitRenjen @Deloitte to help businesses maximize the amazing capabilities of iOS,iPhone, iPad http://nr.apple.com/dE3a4J0q3B",,@PunitRenjen @Deloitte,,781267638941061121,https://twitter.com/tim_cook/status/781267638941061121
2016-09-28 03:28:12,tim_cook,,250,1527,5057,"Condolences to the people of Israel on the passing of Shimon Peres, a true visionary whose efforts for peace will never be forgotten.",,,,780972348866301952,https://twitter.com/tim_cook/status/780972348866301952
2016-09-25 00:40:17,tim_cook,,121,1149,2919,"¡Gracias México por recibirnos! http://nr.apple.com/dE3a8p8z4N",,,,779842927174430720,https://twitter.com/tim_cook/status/779842927174430720
2016-09-17 03:06:36,tim_cook,,345,7075,12323,"A very happy birthday to @narendramodi. Vasudhaiva kutumbakam - the world is one family.",,@narendramodi,,776980648653312000,https://twitter.com/tim_cook/status/776980648653312000
2016-09-16 19:03:34,tim_cook,,265,1517,7017,"Thank you to the Apple Store employees around the world who make days like today magical!pic.twitter.com/eZ6brPM0vk",,,,776859086902038528,https://twitter.com/tim_cook/status/776859086902038528
2016-09-16 11:27:06,tim_cook,,304,1718,4646,"It’s time! #iPhone7 and #AppleWatchSeries2 are here!http://www.apple.com/newsroom/2016/09/iphone-7-and-apple-watch-series-2-arrive-in-stores.html …",,,#iPhone7 #AppleWatchSeries2,776744212939149312,https://twitter.com/tim_cook/status/776744212939149312
2016-09-15 01:23:54,tim_cook,,38,203,860,"Congrats to @XQAmerica’s 10 Super Schools! Learn more about the #XQBigReveal #RethinkHighSchoolhttp://xqsuperschool.org",,@XQAmerica,#XQBigReveal #RethinkHighSchoolhttp,776230026010255360,https://twitter.com/tim_cook/status/776230026010255360
2016-09-14 19:51:51,tim_cook,,139,1573,3566,"Stunning iPhone 7 photos from Rwanda, by travel photographer @austinmannhttp://www.nationalgeographic.com/travel/photography/8-tips-taking-travel-pictures-with-the-iphone7/ …",,@austinmannhttp,,776146462845435904,https://twitter.com/tim_cook/status/776146462845435904
2016-09-14 01:08:09,tim_cook,,100,584,3206,"Thanks PS 161 in NYC for a great visit. Inspiring to see how teachers use iPad to make a big difference for studentspic.twitter.com/j8W44SWKOR",,,,775863674586144769,https://twitter.com/tim_cook/status/775863674586144769
2016-09-12 11:47:11,tim_cook,,124,811,2038,". @ESPN serves up iPhone 7 shots from the #usopen http://www.espn.com/espn/feature/story/_/id/17496880/first-ever-iphone-7-photos-2016-us-open …",,@ESPN,#usopen,775299715143434240,https://twitter.com/tim_cook/status/775299715143434240
2016-09-11 23:38:51,tim_cook,,223,1966,4176,"Touchdown iPhone 7! First photos on @SInowhttp://www.si.com/nfl/photo/2016/09/11/iphone-7-plus-sneak-preview-photos …",,@SInowhttp,,775116424171941888,https://twitter.com/tim_cook/status/775116424171941888
2016-09-08 01:54:13,tim_cook,,331,2140,5553,"What a day! https://m.youtube.com/watch?v=GeoUELDgyM4 …",,,,773700941996433409,https://twitter.com/tim_cook/status/773700941996433409
2016-09-07 22:10:35,tim_cook,,73,743,3576,"Thanks to Olympians @ryan_f_murphy @nathangadrian @KathleenBaker2 @SwimHaley @MJGold for joining today #AppleEvent!pic.twitter.com/rtn4PWYq7K",,@ryan_f_murphy @nathangadrian @KathleenBaker2 @SwimHaley @MJGold,#AppleEvent,773644659469918209,https://twitter.com/tim_cook/status/773644659469918209
2016-09-07 14:37:20,tim_cook,,760,9156,21587,"Sun's coming up in San Francisco and we are ready for a big day!pic.twitter.com/PgLZN7ZcrQ",,,,773530595284529152,https://twitter.com/tim_cook/status/773530595284529152
2016-09-02 03:58:37,tim_cook,,187,1886,3949,"¡Hola Mexico! ¡Vengan a celebrar! https://www.apple.com/mx/retail/viasantafe/ …pic.twitter.com/UkaLsq5Wj6",,,,771557920572002304,https://twitter.com/tim_cook/status/771557920572002304
2016-08-24 05:13:17,tim_cook,,215,2187,5481,"Vicini con affetto e con il cuore rivolto alle vittime.",,,,768315220703924225,https://twitter.com/tim_cook/status/768315220703924225
2016-08-07 14:03:09,tim_cook,,189,1097,4990,"We owe @NatlParkService a debt of gratitude for 100 amazing years. by hiking @YellowstoneNPS @GrandTetonNPSpic.twitter.com/PGGwukKRto",,@NatlParkService @YellowstoneNPS @GrandTetonNPSpic,,762287969235443713,https://twitter.com/tim_cook/status/762287969235443713
2016-08-03 20:05:35,tim_cook,,219,1602,4737,". @AppStore developers have now earned over $50 billion! Congratulations on your success and such inspired creativity.",,@AppStore,,760929629226041345,https://twitter.com/tim_cook/status/760929629226041345
2016-08-03 20:04:51,tim_cook,,140,824,2673,"July was a record-breaker for the @AppStore! Highest-ever monthly billings and money paid to developers.",,@AppStore,,760929444886351872,https://twitter.com/tim_cook/status/760929444886351872
2016-07-31 01:09:38,tim_cook,,130,549,2633,"Thanks to everyone who joined the grand opening of our new store in Brooklyn, and congrats to our team! http://nr.apple.com/dE4O4J5G2b",,,,759556594837225474,https://twitter.com/tim_cook/status/759556594837225474
2016-07-22 22:42:14,tim_cook,,114,1119,3783,"Wir sind bestürzt über die Ereignisse in München. Unsere Gedanken sind bei allen Menschen in der Stadt. #Munich",,,#Munich,756620395168407552,https://twitter.com/tim_cook/status/756620395168407552
2016-07-14 23:16:47,tim_cook,,154,3241,6051,"La France est dans nos coeurs et nos pensées. #Nice",,,#Nice,753729989816688640,https://twitter.com/tim_cook/status/753729989816688640
2016-07-14 20:28:44,tim_cook,,114,895,2313,"Yes, coding CAN be fun! Your kids (and you) are going to love Swift Playgrounds!http://www.macworld.com/article/3095824/ios/meet-swift-playgrounds-the-learn-to-code-ipad-app-that-feels-like-a-puzzle-game.html …",,,,753687695398797313,https://twitter.com/tim_cook/status/753687695398797313
2016-07-10 18:19:00,tim_cook,,112,969,2271,"Proud of our talented team dedicated to providing #accessibility for all usershttp://mashable.com/2016/07/10/apple-innovation-blind-engineer/ …",,,#accessibility,752205497390931968,https://twitter.com/tim_cook/status/752205497390931968
2016-07-08 14:15:29,tim_cook,,200,5124,9634,"""We must all learn to live together as brothers, or we will all perish together as fools.” - Dr. Martin Luther King Jr.",,,,751419437761253376,https://twitter.com/tim_cook/status/751419437761253376
2016-07-08 14:14:35,tim_cook,,82,1304,4123,"Our hearts go out to the families of the fallen officers and the entire #Dallas community. Justice cannot be gained through violence.",,,#Dallas,751419213122678784,https://twitter.com/tim_cook/status/751419213122678784
2016-07-08 02:50:47,tim_cook,repjohnlewis,114,1905,4051,"Senseless killings this week remind us that justice is still out of reach for many. We can and must do better.https://twitter.com/repjohnlewis/status/751049575893504001 …",,,,751247130048630784,https://twitter.com/tim_cook/status/751247130048630784
2016-07-04 14:14:07,tim_cook,,132,1154,4021,"Wishing everyone a safe & happy #IndependenceDay ""We hold these truths to be self-evident, that all men are created equal.""",,,#IndependenceDay,749969543112437761,https://twitter.com/tim_cook/status/749969543112437761
2016-06-28 22:07:54,tim_cook,,451,9589,24084,"Dualarımız Türk halkı için #Istanbul",,,#Istanbul,747914447159595008,https://twitter.com/tim_cook/status/747914447159595008
2016-06-26 22:06:43,tim_cook,,158,1470,5991,"Happy Pride to everyone who turned out this weekend to celebrate! #applepride #pride2016pic.twitter.com/3GZlc9s6bl",,,#applepride #pride2016pic,747189372462600192,https://twitter.com/tim_cook/status/747189372462600192
2016-06-16 13:42:48,tim_cook,,158,782,3546,"It’s Day 4 of #WWDC2016 in San Francisco. Hope everyone is having a great week!pic.twitter.com/Y4zN5HQJYm",,,#WWDC2016,743438680962961408,https://twitter.com/tim_cook/status/743438680962961408
2016-06-12 15:56:25,tim_cook,,191,2964,7588,"Our hearts go out to the victims of the unspeakable tragedy in #Orlando, their families and all who grieve with them.",,,#Orlando,742022755445440512,https://twitter.com/tim_cook/status/742022755445440512
