date,username,to,replies,retweets,favorites,text,geo,mentions,hashtags,id,permalink
2018-03-27 19:53:04,tim_cook,,205,705,5274,"Thanks to the students and faculty of Lane Tech for being our gracious hosts. Rich with history and forward-thinking — we couldn't ask for a better place to talk about the future of education. @ChiPubSchoolspic.twitter.com/YcriSm6eeB",,@ChiPubSchoolspic,,978721587741560839,https://twitter.com/tim_cook/status/978721587741560839
2018-03-27 12:46:22,tim_cook,,360,2411,14071,"Good morning, Chicago! We’re going back to school today for some exciting announcements in education.pic.twitter.com/7FhJ927reO",,,,978614201538228224,https://twitter.com/tim_cook/status/978614201538228224
2018-03-27 00:41:27,tim_cook,,97,1255,6480,"""In the field of public education the doctrine of 'separate but equal' has no place."" Thank you to Linda Brown for what you stood up for, and the impact it had on this nation. Rest In Peace.pic.twitter.com/GCCslWTQHi",,,,978431772416446466,https://twitter.com/tim_cook/status/978431772416446466
2018-03-26 00:24:16,tim_cook,,93,537,4197,"Congratulations to @DukeMBB and Coach K on a terrific season! You make us all proud #Duke",,@DukeMBB,#Duke,978065061326610432,https://twitter.com/tim_cook/status/978065061326610432
2018-03-19 17:22:23,tim_cook,,96,639,5201,"We stand with our Austin coworkers, friends and neighbors who are facing such senseless attacks. Thank you to all those in law enforcement working to keep Austin safe.",,,,975784563204005888,https://twitter.com/tim_cook/status/975784563204005888
2018-03-17 12:49:19,tim_cook,,158,676,6657,"Happy #StPatricksDay to our team in Ireland and everyone celebrating around the world! Sláinte!",,,#StPatricksDay,974991067463409664,https://twitter.com/tim_cook/status/974991067463409664
2018-03-14 12:58:16,tim_cook,,375,8587,30041,"“The greatest enemy of knowledge is not ignorance, it is the illusion of knowledge.” -Stephen Hawking. We will always be inspired by his life and ideas. RIP.",,,,973906157264830465,https://twitter.com/tim_cook/status/973906157264830465
2018-03-08 14:01:10,tim_cook,,392,2768,12939,"“There are two powers in the world; one is the sword and the other is the pen. There is a third power stronger than both, that of women.” — Malala Thank you to all of the inspiring women I work with at Apple, and to every woman who fights for equality. #InternationalWomensDay",,,#InternationalWomensDay,971747659743547392,https://twitter.com/tim_cook/status/971747659743547392
2018-03-03 22:43:23,tim_cook,,190,924,5419,"So proud of @AuburnMBB @coachbrucepearl on winning the SEC Championship. Congrats! Party like its 1999!",,@AuburnMBB @coachbrucepearl,,970067137346732032,https://twitter.com/tim_cook/status/970067137346732032
2018-03-02 16:29:37,tim_cook,,219,1447,8403,"Stunning photos that capture the colorful festival of Holi by @prashvish in Nandgaon, @amitmehraphoto in Vrindavan and @ashishjparmar in Bengaluru, India #ShotoniPhone #iPhoneXpic.twitter.com/ykSNJDGvAl",,@prashvish @amitmehraphoto @ashishjparmar,#ShotoniPhone #iPhoneXpic,969610687520452608,https://twitter.com/tim_cook/status/969610687520452608
2018-02-28 14:55:40,tim_cook,,182,470,3660,"Another great way to close those Activity Rings this ski season!https://www.apple.com/newsroom/2018/02/apple-watch-series-3-now-tracks-skiing-and-snowboarding-activity/ …",,,,968862268975808513,https://twitter.com/tim_cook/status/968862268975808513
2018-02-25 00:07:39,tim_cook,AngelaAhrendts,246,369,3450,"Thank you for the warm welcome Austria! https://twitter.com/angelaahrendts/status/967446876617261056 …",,,,967551629804290048,https://twitter.com/tim_cook/status/967551629804290048
2018-02-24 16:53:46,tim_cook,,895,13712,50203,"Remembering Steve, our friend and leader, on his 63rd birthday: ""The thing that bound us together at Apple was the ability to make things that were going to change the world.” We are forever bound to that goal — and to you, Steve.pic.twitter.com/rDvzR8s2F8",,,,967442438854815745,https://twitter.com/tim_cook/status/967442438854815745
2018-02-19 18:08:32,tim_cook,,257,1128,6907,"“Let us have faith that right makes might, and in that faith, let us, to the end, dare to do our duty as we understand it.” -Abraham Lincoln #PresidentsDay2018",,,#PresidentsDay2018,965649314113441792,https://twitter.com/tim_cook/status/965649314113441792
2018-02-16 01:54:07,tim_cook,,419,923,7512,"Wishing our customers around the world a happy, healthy and prosperous #YearoftheDog 新年兴旺!",,,#YearoftheDog,964316930529140741,https://twitter.com/tim_cook/status/964316930529140741
2018-02-15 00:33:05,tim_cook,,388,1923,11876,"We pray for the victims of today’s shooting in Florida, for their families and loved ones, and for an end to the senseless violence that has taken so many innocent lives.",,,,963934152272695296,https://twitter.com/tim_cook/status/963934152272695296
2018-02-10 23:32:20,tim_cook,,184,359,2542,"Brasil, aproveitem o feriado dessa festa tão bonita! #ShotoniPhone by @lalai #iPhoneXpic.twitter.com/BdNYPUmWXT",,@lalai,#ShotoniPhone #iPhoneXpic,962469310214979584,https://twitter.com/tim_cook/status/962469310214979584
2018-02-09 21:08:22,tim_cook,,371,908,8151,"Hey Siri, play my weekend playlist! Excited to meet new HomePod owners at our store at Apple Park today!pic.twitter.com/qfrZDuWemv",,,,962070693620822016,https://twitter.com/tim_cook/status/962070693620822016
2018-02-08 14:34:25,tim_cook,,269,1056,6671,"Time to do something good for your heart! Earn this Heart Month Challenge award on Apple Watch by closing your Exercise ring seven days in a row starting February 8.pic.twitter.com/O3HWIjzhvZ",,,,961609166891569153,https://twitter.com/tim_cook/status/961609166891569153
2018-02-06 20:42:48,tim_cook,,265,703,3768,"Listen up! @TechCrunch says: ""Apple’s HomePod is easily the best sounding mainstream smart speaker ever.”https://techcrunch.com/2018/02/06/a-four-sentence-homepod-review-with-appendices/ …",,@TechCrunch,,960977097182162944,https://twitter.com/tim_cook/status/960977097182162944
2018-01-31 23:16:31,tim_cook,,261,1015,6562,"Gorgeous #ShotoniPhone photos from around the world taken by lukeshadbolt in Niseko, Japan, @Izkiz in Cappadocia, Turkey and @sarakhanov in Myhove, Ukraine #iPhoneXpic.twitter.com/ZsRnI6k8Ut",,@Izkiz @sarakhanov,#ShotoniPhone #iPhoneXpic,958841453857292288,https://twitter.com/tim_cook/status/958841453857292288
2018-01-30 21:26:24,tim_cook,andyyto,155,308,3419,"Thanks @andyyto for sharing this stunning #ShotoniPhone photo. Love seeing what our customers are creating with iPhone X.https://twitter.com/andyyto/status/958429377750028290 …",,@andyyto,#ShotoniPhone,958451352169996288,https://twitter.com/tim_cook/status/958451352169996288
2018-01-27 18:52:24,tim_cook,,251,2047,11199,"The @HolocaustMuseum is a profound reminder that we must speak up in the face of hate and racism in our world. We must never forget those who lost their lives, and we must honor their legacies with our actions. #WeRememberpic.twitter.com/GhJFR7hYuk",,@HolocaustMuseum,#WeRememberpic,957325433078517760,https://twitter.com/tim_cook/status/957325433078517760
2018-01-23 15:17:17,tim_cook,,210,522,4165,"Thank you, Toronto, for showing me your culture, your passion, and your creativity! Hope to see you again soon. / Merci, Toronto, de m’avoir montré ta culture, ta passion et ta créativité. À bientôt, j’espère.pic.twitter.com/YBwFJSZuXx",,,,955821747374362624,https://twitter.com/tim_cook/status/955821747374362624
2018-01-23 14:58:18,tim_cook,,62,305,1934,"Congrats and best of luck to these year 4 students at @SheridanCollege, kicking off their app development projects built with Swift. / Félicitations et bonne chance à ces étudiants de 4e année du @SheridanCollege, qui lancent leurs projets de développement d’app avec Swift.pic.twitter.com/2oqrpe9I18",,@SheridanCollege @SheridanCollege,,955816969319698434,https://twitter.com/tim_cook/status/955816969319698434
2018-01-23 03:14:31,tim_cook,,69,311,2020,"Thanks @MapleLeafs and @RealKyper for an exciting night of hockey! Tough Loss. #GoLeafsGo / Merci aux @MapleLeafs et à @RealKyper pour une soirée de hockey enlevante! Ce n’est que partie remise. #GoLeafsGopic.twitter.com/tYdqQH1RAo",,@MapleLeafs @RealKyper @MapleLeafs @RealKyper,#GoLeafsGo #GoLeafsGopic,955639857031806976,https://twitter.com/tim_cook/status/955639857031806976
2018-01-23 02:12:32,tim_cook,DanielCaesar,35,264,1983,"Loved what I heard at the studio today. Great to meet you @DanielCaesar and best of luck this week at the #Grammys. / J’ai adoré ce que j’ai entendu au studio aujourd’hui. Enchanté de t’avoir rencontré, @DanielCaesar, et bonne chance aux #Grammys cette semaine.https://twitter.com/danielcaesar/status/955581722803847170 …",,@DanielCaesar @DanielCaesar,#Grammys #Grammys,955624260038545408,https://twitter.com/tim_cook/status/955624260038545408
2018-01-22 20:31:31,tim_cook,,80,623,3265,"Thanks @tobi and @Shopify for showing me your latest work with AR and VR. Great to be back in Canada! / Merci @tobi et @Shopify de m’avoir montré votre plus récent travail en RA et en RV. Content d’être de retour au Canada!pic.twitter.com/0scTP3PsBb",,@tobi @Shopify @tobi @Shopify,,955538436827549698,https://twitter.com/tim_cook/status/955538436827549698
2018-01-22 13:59:51,tim_cook,GMA,241,2588,10880,"Apple is proud to support the courageous, visionary @Malala in advancing every girl’s right to 12 years of free, safe, quality education. Together we’re committing to expand the reach of @MalalaFund and provide secondary school opportunities to girls around the world.https://twitter.com/gma/status/955433789055942657 …",,@Malala @MalalaFund,,955439870922645505,https://twitter.com/tim_cook/status/955439870922645505
2018-01-19 17:11:29,tim_cook,,134,466,3725,"Thanks to the students, teachers and staff @HarlowCollege outside London, one of the first in Europe to adopt Apple’s App Development with Swift curriculum. Keep learning, keep coding!pic.twitter.com/DvastatUru",,@HarlowCollege,,954400937094737921,https://twitter.com/tim_cook/status/954400937094737921
2018-01-18 02:20:38,tim_cook,,239,362,4699,"Hello from the biggest little store in the Apple family! Loved meeting our Reno team—thanks for all you do!pic.twitter.com/rlxNydOqt4",,,,953814358361911296,https://twitter.com/tim_cook/status/953814358361911296
2018-01-17 21:40:09,tim_cook,,247,822,4885,"Breaking ground in Reno today with @GovSandoval & @MayorSchieve as part of our data center expansion plan, one of many Apple initiatives which will contribute $350 billion to the U.S. economy and create 20,000 new jobs over the next 5 years.pic.twitter.com/g40dlHsxuC",,@GovSandoval @MayorSchieve,,953743770985648128,https://twitter.com/tim_cook/status/953743770985648128
2018-01-16 23:30:04,tim_cook,rebeccaekahn,89,188,1388,"It was a pleasure talking to you, @rebeccaekahn! Looking forward to more conversations between Apple and the bright young minds at @NCWITAIC.https://twitter.com/rebeccaekahn/status/953312177661890562 …",,@rebeccaekahn @NCWITAIC,,953409044441526272,https://twitter.com/tim_cook/status/953409044441526272
2018-01-15 22:07:35,tim_cook,,191,684,5002,"MLK reminded us to live our values and serve our communities. Thank you to the hundreds of Apple employees who volunteered today at California School for the Deaf and projects across the country. @csdeagles #MLKpic.twitter.com/iBGOY2q414",,@csdeagles,#MLKpic,953025898826969088,https://twitter.com/tim_cook/status/953025898826969088
2018-01-15 13:29:02,tim_cook,,436,4617,16959,"“Darkness cannot drive out darkness; only light can do that. Hate cannot drive out hate; only love can do that.” Let’s find the light and the love, together. #MLK",,,#MLK,952895400477773824,https://twitter.com/tim_cook/status/952895400477773824
2018-01-11 03:26:10,tim_cook,,544,779,7212,"Our prayers are with the victims of the Southern California mudslides, their families and the first responders working to keep everyone safe.",,,,951294133557108736,https://twitter.com/tim_cook/status/951294133557108736
2018-01-01 14:57:53,tim_cook,,640,3289,17239,"As we begin 2018, my New Year’s wish for everyone is in the words RFK spoke nearly half a century ago. “Let us dedicate ourselves to what the Greeks wrote so many years ago: to tame the savageness of man and make gentle the life of this world.”",,,,947844333436153856,https://twitter.com/tim_cook/status/947844333436153856
2018-01-01 05:12:41,tim_cook,,706,3116,22594,"Goodbye 2017, Hello 2018! The best year yet starts now. #HappyNewYear to everyone!",,,#HappyNewYear,947697059896770560,https://twitter.com/tim_cook/status/947697059896770560
2017-12-25 14:35:39,tim_cook,,841,2173,21881,"To my friends and coworkers, and everyone celebrating around the world, I wish you and your families a joyous, peaceful holiday season. Merry Christmas!",,,,945302021648793600,https://twitter.com/tim_cook/status/945302021648793600
2017-12-22 20:51:53,tim_cook,,330,934,7775,"Here’s to the tens of thousands of dedicated Apple Retail employees around the world, spreading joy at the busiest time of the year! Thank you for helping so many customers this holiday season, and for inspiring us every day.pic.twitter.com/UufdplgBEx",,,,944309540165640192,https://twitter.com/tim_cook/status/944309540165640192
2017-12-21 15:09:08,tim_cook,,431,2677,13713,"You never know who you’ll run into on the Apple campus! The power of ARKit is coming to @PokemonGoApp today — taking its AR to a new level, including more interactivity between Pokémon and Trainers.pic.twitter.com/ob9K4UEvqg",,@PokemonGoApp,,943860895062507521,https://twitter.com/tim_cook/status/943860895062507521
2017-12-18 01:31:40,tim_cook,CBSSunday,135,396,2065,"This story makes our hearts sing! @Adam_G88 and the P177Q iPad Band, you are all rock stars. Keep making music! @CBSSunday #Accessibilityhttps://twitter.com/cbssunday/status/942497761626292229 …",,@Adam_G88 @CBSSunday,#Accessibilityhttps,942568008773337093,https://twitter.com/tim_cook/status/942568008773337093
2017-12-14 19:53:51,tim_cook,,210,546,2312,"If ever there were an occasion to come together to help people, this is it. Congress must act before the end of the year to bring certainty and security to the lives of Dreamers. @Koch_Industries @PostOpinionshttp://apple.co/2CkQbFo",,@Koch_Industries @PostOpinionshttp,,941395833848717312,https://twitter.com/tim_cook/status/941395833848717312
2017-12-14 14:37:28,tim_cook,,487,1924,9077,"iMac Pro is here! Workstation-class performance and that brilliant 5K display — we think you pros are going to love it! #iMacProhttps://www.apple.com/newsroom/2017/12/imac-pro-the-most-powerful-mac-ever-available-today/ …",,,#iMacProhttps,941316211639386114,https://twitter.com/tim_cook/status/941316211639386114
2017-12-13 18:53:56,tim_cook,,151,469,2532,"Innovation in the heart of Texas! Proud to team up with @Finisar, the latest recipient from our Advanced Manufacturing Fund. Their new site will create hundreds of jobs building iPhone components in Sherman, Tex.http://www.heralddemocrat.com/news/20171213/apple-awards-finisar-390m …",,@Finisar,,941018367355265024,https://twitter.com/tim_cook/status/941018367355265024
2017-12-12 21:28:03,tim_cook,,179,329,1544,"Excited to work with @ChicagosMayor @ChiPubSchools @ChiCityColleges & local organizations like @1871Chicago to help more students learn coding — a critical skill for today’s economy and the future.http://www.chicagotribune.com/business/ct-biz-apple-coding-chicago-20171211-story.html …",,@ChicagosMayor @ChiPubSchools @ChiCityColleges @1871Chicago,,940694763073822723,https://twitter.com/tim_cook/status/940694763073822723
2017-12-12 12:39:42,tim_cook,,221,826,5774,"A very happy #Hanukkah to everyone celebrating! !חנוכה שמח",,,#Hanukkah,940561800277377024,https://twitter.com/tim_cook/status/940561800277377024
2017-12-10 18:54:47,tim_cook,,209,1472,7031,"Beyond the urgent, never-ending work of protecting the rights we enjoy, each generation — including ours — has a responsibility to advance and enlarge the definition of human rights. #HumanRightsDay",,,#HumanRightsDay,939931415856136193,https://twitter.com/tim_cook/status/939931415856136193
2017-12-09 20:37:07,tim_cook,,104,497,3952,"Thanks to the Apple team for our biggest @ToysForTots_USA collection yet, and to @USMC for making the holiday season bright for so many children. We thank you for your service.pic.twitter.com/I4k00jjZPb",,@ToysForTots_USA @USMC,,939594782426284032,https://twitter.com/tim_cook/status/939594782426284032
2017-12-09 02:05:05,tim_cook,,115,658,5496,"A huge thanks @gwenstefani for celebrating the holidays with us and performing from your new holiday album. It was B-A-N-A-N-A-S!pic.twitter.com/ADYt1Fz5FW",,@gwenstefani,,939314928749461504,https://twitter.com/tim_cook/status/939314928749461504
2017-12-08 02:53:03,tim_cook,,150,880,5306,"Imagination and creativity drives us at Apple. Thank you to the talented artists and creatives who kept us inspired through 2017 #Bestof2017 #OffTheCharts2017 https://nr.apple.com/dE0n7d4g4w",,,#Bestof2017 #OffTheCharts2017,938964613688737792,https://twitter.com/tim_cook/status/938964613688737792
2017-12-06 23:23:30,tim_cook,JustinTrudeau,388,864,5016,"Thank you @JustinTrudeau on behalf of our Canadian employees and everyone at Apple. We appreciate your deep commitment to the many values we share.https://twitter.com/JustinTrudeau/status/938520608513683456 …",,@JustinTrudeau,,938549490046287873,https://twitter.com/tim_cook/status/938549490046287873
2017-12-06 21:33:10,tim_cook,,75,849,6469,"Our thoughts are with our fellow Californians affected by the devastating wildfires, and the brave firefighters working to contain them—please stay safe.",,,,938521725326766080,https://twitter.com/tim_cook/status/938521725326766080
2017-12-04 12:42:34,tim_cook,,285,1463,6981,"Coding is the language of the future, giving people of all ages and backgrounds the chance to create something new. Thanks to Shanghai No. 4 School for the Deaf for letting me join your #HourOfCode session!pic.twitter.com/1dEAyaVznu",,,#HourOfCode,937663417615126528,https://twitter.com/tim_cook/status/937663417615126528
2017-11-30 23:10:27,tim_cook,,144,478,2074,"This #WorldAIDSDay we celebrate saving lives, through 144 million days’ worth of medication to prevent the transmission of HIV. Thanks to our customers for joining us in supporting (RED), and for bringing everyone closer to an AIDS-free generation.https://www.apple.com/newsroom/2017/11/apple-and-red-celebrate-record-year-of-giving/ …",,,#WorldAIDSDay,936371880319115265,https://twitter.com/tim_cook/status/936371880319115265
2017-11-29 03:22:52,tim_cook,,476,3343,11093,"Everyone should have the opportunity to learn to code. We’re celebrating #HourofCode with free workshops next week at all Apple Stores.http://apple.co/hourofcode",,,#HourofCode,935710625921081344,https://twitter.com/tim_cook/status/935710625921081344
2017-11-26 01:04:56,tim_cook,,286,1614,8969,"So proud of @AuburnFootball @CoachGusMalzahn This is our time!",,@AuburnFootball @CoachGusMalzahn,,934588752017620993,https://twitter.com/tim_cook/status/934588752017620993
2017-11-24 20:40:48,tim_cook,,536,4975,13942,"نعبِّر عن أسفنا الشديد تجاه الهجوم المروع على مسجد الروضة في مصر ونعزي جميع أهلها.",,,,934159891429822465,https://twitter.com/tim_cook/status/934159891429822465
2017-11-23 16:47:53,tim_cook,,346,1284,11315,"Happy #Thanksgiving! Grateful this year for family and friends, the incredibly talented team at Apple and our customers all over the world.",,,#Thanksgiving,933738888828370944,https://twitter.com/tim_cook/status/933738888828370944
2017-11-15 00:32:15,tim_cook,,481,2723,16110,"Congratulations Australia! Another important step toward equality for all. #MarriageEquality",,,#MarriageEquality,930594260352561152,https://twitter.com/tim_cook/status/930594260352561152
2017-11-12 00:15:07,tim_cook,,210,1428,6513,"Congratulations @AuburnFootball @CoachGusMalzahn on an EPIC win! Couldn’t be prouder. See you in 2 weeks. WDE! #Auburn",,@AuburnFootball @CoachGusMalzahn,#Auburn,929502783715164162,https://twitter.com/tim_cook/status/929502783715164162
2017-11-11 18:54:05,tim_cook,,107,814,5952,"Happy #VeteransDay to the brave men and women who have served in our armed forces, and all those who have supported them. We salute you for your service and your sacrifice.",,,#VeteransDay,929421991752249344,https://twitter.com/tim_cook/status/929421991752249344
2017-11-11 00:50:40,tim_cook,,95,353,3091,"Honored to welcome Gen. Lori Robinson to campus today, and proud to work alongside so many courageous veterans here at Apple. Thank you for your service. #VeteransDay2017pic.twitter.com/AfwZem9o8T",,,#VeteransDay2017pic,929149340253220864,https://twitter.com/tim_cook/status/929149340253220864
2017-11-09 23:49:35,tim_cook,,231,699,3952,"Love the amazing photos we’re seeing from iPhone X users! Check out this stunning work by @Austinmann #ShotoniPhonehttp://austinmann.com/trek/iphone-x-camera-review-guatemala …",,@Austinmann,#ShotoniPhonehttp,928771583723823104,https://twitter.com/tim_cook/status/928771583723823104
2017-11-05 21:15:24,tim_cook,,320,1514,9382,"Shocked and sorrowed by the heartbreaking news from Texas. Prayers for all those touched by violence today: victims, survivors, worshippers.",,,,927283228737650688,https://twitter.com/tim_cook/status/927283228737650688
2017-11-04 01:36:07,tim_cook,,305,1039,8556,"To all my incredibly talented coworkers, congratulations on the launch of iPhone X! Thanks @WALKTHEMOONband for celebrating with us!pic.twitter.com/Jhg31JPIzN",,@WALKTHEMOONband,,926624066043121664,https://twitter.com/tim_cook/status/926624066043121664
2017-11-02 23:51:34,tim_cook,,740,2604,15273,"iPhone X is here! A big thank-you to all our customers in Sydney, and everyone turning out around the world Friday! pic.twitter.com/5NKXUnePLu",,,,926235364313960449,https://twitter.com/tim_cook/status/926235364313960449
2017-11-01 19:23:20,tim_cook,TheEllenShow,406,1852,15498,"Gotta wait til Friday! Meet me at the Apple Store at 8 a.m. — we’ll let you open the doors! #iPhonehttps://twitter.com/TheEllenShow/status/925783274869231616 …",,,#iPhonehttps,925805475790065664,https://twitter.com/tim_cook/status/925805475790065664
2017-10-31 23:29:51,tim_cook,,124,1365,9510,"Tonight our hearts are with the victims, their families and all the people of New York. Stay safe and stay strong.",,,,925505126663577601,https://twitter.com/tim_cook/status/925505126663577601
2017-10-26 01:09:51,tim_cook,,311,1267,8227,"""If you love the life you live, live it every day.” Fats Domino inspired generations. His music & legacy will live on forever. Rest in peace",,,,923355962135625730,https://twitter.com/tim_cook/status/923355962135625730
2017-10-21 21:28:47,tim_cook,,138,258,1732,"Thanks @ChicagosMayor for a great conversation about education, diversity and Apple’s strong ties with Chicago.http://apple.co/2yFhScc",,@ChicagosMayor,,921850779698315264,https://twitter.com/tim_cook/status/921850779698315264
2017-10-21 00:15:06,tim_cook,,142,658,5623,"My kind of town, Chicago is My kind of people, too. Thank you, Chicago, for welcoming us to the Riverwalk!pic.twitter.com/6WhORpMdR5",,,,921530245588635650,https://twitter.com/tim_cook/status/921530245588635650
2017-10-19 02:34:07,tim_cook,,223,1911,8627,"Happy #Diwali! May the festival of lights spread love, peace & prosperity to all! #ShotoniPhone by @prashvishpic.twitter.com/Ax8NLXPzzM",,@prashvishpic,#Diwali #ShotoniPhone,920840455281033216,https://twitter.com/tim_cook/status/920840455281033216
2017-10-16 15:30:00,tim_cook,,190,618,5070,"To our friends, coworkers and all those in the path of #Ophelia - please stay safe.",,,#Ophelia,919948548522651648,https://twitter.com/tim_cook/status/919948548522651648
2017-10-13 17:48:55,tim_cook,,169,372,3394,"Enjoyed talking with the bright students from the Osservatorio program in Firenze today. Great questions- Grazie e a presto!pic.twitter.com/z9fB2d4OQb",,,,918896343988523009,https://twitter.com/tim_cook/status/918896343988523009
2017-10-13 06:42:20,tim_cook,,117,466,3838,"Thanks to the many talented iOS app developers who previewed AR features for me this week. Hearing great ideas across Europe! @sodrapic.twitter.com/rJBgCeGUd9",,@sodrapic,,918728591604633600,https://twitter.com/tim_cook/status/918728591604633600
2017-10-12 14:02:22,tim_cook,,187,927,6379,"A visit to the breathtaking forests of northern Sweden with @IggesundAB, our partners in innovation and sustainable packaging.pic.twitter.com/STYKFQ8LZt",,@IggesundAB,,918476943544033280,https://twitter.com/tim_cook/status/918476943544033280
2017-10-11 13:36:57,tim_cook,,82,511,3530,"Robot dance party! Thanks to these talented young coders from @HT_Primary. Great to meet you today at Apple Regent Street! #EUCodeWeekpic.twitter.com/kICS4oy05c",,@HT_Primary,#EUCodeWeekpic,918108160010878981,https://twitter.com/tim_cook/status/918108160010878981
2017-10-10 15:45:58,tim_cook,,130,988,7255,"Our thoughts are with our Bay Area friends & neighbors affected by wildfires. Please stay safe! Apple is donating to aid relief efforts.",,,,917778240021909504,https://twitter.com/tim_cook/status/917778240021909504
2017-10-09 13:58:56,tim_cook,,64,247,1555,"Très impressionné par l’expérience @CoachGuitar. Congratulations on 6M downloads! We can’t wait to see what you do next.pic.twitter.com/O7RIjusuzh",,@CoachGuitar,,917388917766311936,https://twitter.com/tim_cook/status/917388917766311936
2017-10-09 13:38:01,tim_cook,,74,321,2291,"Thrilled to meet this team of entrepreneurs @my_little_paris, whose success is born from creativity and passion.pic.twitter.com/kQ18e3Zghe",,@my_little_paris,,917383650148220933,https://twitter.com/tim_cook/status/917383650148220933
